{
  "$schema": "schema/source-root-manifest.schema.json",
  "schema_version": "1.0",
  "status": "frozen",
  "rule_version": "source-root-treatment-scrub-v1",
  "scrub_policy": {
    "fixed_remove_roots": [
      ".claude",
      ".agents",
      ".codex",
      "CLAUDE.md",
      "CODEX.md",
      "cc-hooks-on",
      "cc-hooks-off",
      "docs/changes/feat-397-spec-design-agent-team",
      "docs/development/change-workflow.md"
    ],
    "instruction_marker": "SKILL.md",
    "non_product_instruction_action": "remove_containing_directory",
    "product_owned_instruction_action": "preserve_declared_root"
  },
  "agents_projection": {
    "algorithm": "preamble-before-first-level2-plus-exact-sections-v1",
    "preamble_boundary": "bytes_before_first_line_starting_with_##_space",
    "included_level2_headings": [
      "架构总览",
      "架构红线",
      "工作红线"
    ],
    "forbidden_level2_headings": [
      "Project overview"
    ],
    "source_policy": "project_main_projects_cutoff_bytes_external_removes_agents"
  },
  "base_repository_method": {
    "method": "counterfactual-latest-base-v1",
    "projection": "DP1-counterfactual-latest-v1",
    "framework_workflow_commit": "adb93d33a2ec5443a647dd367eb67557ac72e199",
    "framework_workflow_tree": "025b16b8c900c2b40ac23b126f99eda94e280633",
    "clean_policy": "remove_active_and_retired_keep_completed_archive"
  },
  "sources": [
    {
      "source_id": "nano-h01-088b2f8b",
      "kind": "project_repository",
      "control_path": ".",
      "cutoff_ref": "088b2f8b1b5327745d2f489ad131015904d5ae0d",
      "cutoff_tree": "e80e045164ed91cc13197dfab5dc2a04e55569ad",
      "archive_prefix": "",
      "exposed_root": ".",
      "agents_policy": "project_from_cutoff_projection",
      "product_owned_instruction_roots": [
        "src/personal_assistant/builtin_skills"
      ],
      "expected_instruction_roots": [
        ".claude/skills/change-code-review",
        ".claude/skills/change-design-author",
        ".claude/skills/change-design-reviewer",
        ".claude/skills/change-impl-worker",
        ".claude/skills/change-orchestrator",
        ".claude/skills/change-retro",
        ".claude/skills/change-reviewer",
        ".claude/skills/change-spec-author",
        ".claude/skills/change-spec-reviewer",
        ".claude/skills/change-verifier",
        ".claude/skills/codebase-design",
        ".claude/skills/improve-codebase-architecture",
        ".claude/skills/systematic-debugging"
      ],
      "expected_removed_roots": [
        ".claude",
        "CLAUDE.md",
        "cc-hooks-off",
        "cc-hooks-on",
        "docs/changes/feat-397-spec-design-agent-team"
      ],
      "hashes": {
        "raw_archive_sha256": "1369a2181f3d173fdb5e364d1d613f81e2d44c5ea2a06f48fd165b957dda980c",
        "source_agents_sha256": "e0b5bb656e0e7e50ef095e509a5e1b9f5e6af05e928f021aae3fc20211171fa1",
        "agents_projection_sha256": "a58574efe149bf2ed4669c682a7bbec7a770175576a9248213358681ce76be48",
        "removed_files_manifest_sha256": "2e573549095b30b3c66642a2af54db6d5b68bc9a0c82f48c4e780da1e2d6e2e8",
        "post_filter_files_manifest_sha256": "e1e99a66b490a1735ec8990c1b7cdbbe2544928f5b1b44521dacc21114e0982c"
      }
    },
    {
      "source_id": "nano-h02-e9a2a02b",
      "kind": "project_repository",
      "control_path": ".",
      "cutoff_ref": "e9a2a02b48a651bdd1cb871c7a1a27c0f0c1c0d6",
      "cutoff_tree": "64ee09dd5aae44f36fff9325835c7c45dc088b5c",
      "archive_prefix": "",
      "exposed_root": ".",
      "agents_policy": "project_from_cutoff_projection",
      "product_owned_instruction_roots": [
        "src/personal_assistant/builtin_skills"
      ],
      "expected_instruction_roots": [
        ".claude/skills/change-code-review",
        ".claude/skills/change-design-author",
        ".claude/skills/change-design-reviewer",
        ".claude/skills/change-fast-close",
        ".claude/skills/change-impl-worker",
        ".claude/skills/change-orchestrator",
        ".claude/skills/change-orchestrator-simple",
        ".claude/skills/change-retro",
        ".claude/skills/change-reviewer",
        ".claude/skills/change-spec-author",
        ".claude/skills/change-spec-reviewer",
        ".claude/skills/change-verifier",
        ".claude/skills/codebase-design",
        ".claude/skills/improve-codebase-architecture",
        ".claude/skills/prod-fleet-deploy",
        ".claude/skills/systematic-debugging",
        "docs/changes/archive/refactor-486-agent-native-repository-knowledge-system/research-writing-artifacts/skill"
      ],
      "expected_removed_roots": [
        ".claude",
        "CLAUDE.md",
        "cc-hooks-off",
        "cc-hooks-on",
        "docs/changes/feat-397-spec-design-agent-team",
        "docs/development/change-workflow.md",
        "docs/changes/archive/refactor-486-agent-native-repository-knowledge-system/research-writing-artifacts/skill"
      ],
      "hashes": {
        "raw_archive_sha256": "2fd34f6d0cccd213b8d1963b0c6e102f54ef0696ca20cbdfe4b9f3cdbb280923",
        "source_agents_sha256": "c948b0beb8172d4e818349daaa9e11b6f28039e443c7764b97475817c9101420",
        "agents_projection_sha256": "0bdb6e9a69ff0d28784ea0bd374ac9416234adeb531a10f92fbd730f94517859",
        "removed_files_manifest_sha256": "644182360362f6b139090f71335087e950ef70bf844f822e906d0fe80e446704",
        "post_filter_files_manifest_sha256": "0fd4fc41890aa23af8b2e8afbbbd9007e57f983974978a021ada2525eeec62de"
      }
    },
    {
      "source_id": "nano-h03-ef52bbb1",
      "kind": "project_repository",
      "control_path": ".",
      "cutoff_ref": "ef52bbb16592fcd98c785136084dd47d78552ff7",
      "cutoff_tree": "08c7429c55d9672d5a1d7d49bda85c53843e55e3",
      "archive_prefix": "",
      "exposed_root": ".",
      "agents_policy": "project_from_cutoff_projection",
      "product_owned_instruction_roots": [
        "src/personal_assistant/builtin_skills"
      ],
      "expected_instruction_roots": [
        ".claude/skills/change-code-review",
        ".claude/skills/change-design-author",
        ".claude/skills/change-design-reviewer",
        ".claude/skills/change-fast-close",
        ".claude/skills/change-impl-worker",
        ".claude/skills/change-orchestrator",
        ".claude/skills/change-orchestrator-simple",
        ".claude/skills/change-retro",
        ".claude/skills/change-reviewer",
        ".claude/skills/change-spec-author",
        ".claude/skills/change-spec-reviewer",
        ".claude/skills/change-verifier",
        ".claude/skills/codebase-design",
        ".claude/skills/improve-codebase-architecture",
        ".claude/skills/prod-fleet-deploy",
        ".claude/skills/systematic-debugging",
        "docs/changes/archive/refactor-486-agent-native-repository-knowledge-system/research-writing-artifacts/skill"
      ],
      "expected_removed_roots": [
        ".claude",
        "CLAUDE.md",
        "cc-hooks-off",
        "cc-hooks-on",
        "docs/changes/feat-397-spec-design-agent-team",
        "docs/development/change-workflow.md",
        "docs/changes/archive/refactor-486-agent-native-repository-knowledge-system/research-writing-artifacts/skill"
      ],
      "hashes": {
        "raw_archive_sha256": "b0c8672882a99b02caa0fe91d8233f6f76e08f120000e3e3f7a916156498046e",
        "source_agents_sha256": "d4965b818ec7f4b6e1c618d71b475febc4b65ac7e78e6311fc7aee97ebd40e78",
        "agents_projection_sha256": "0bdb6e9a69ff0d28784ea0bd374ac9416234adeb531a10f92fbd730f94517859",
        "removed_files_manifest_sha256": "a85a80c2c5671ea3437d50950390810a8fac50cd91d0f9802711e72ba9ef12fc",
        "post_filter_files_manifest_sha256": "20f77c920876f15e7903a6403b1726302bd6baa8d551e3c1ba3180339d23ef9d"
      }
    },
    {
      "source_id": "nano-h04-a51d9915",
      "kind": "project_repository",
      "control_path": ".",
      "cutoff_ref": "a51d9915e2eee83e375f13936df976fb82ed4475",
      "cutoff_tree": "01aa4cf587fae97f1c66986b7c216794b2584d78",
      "archive_prefix": "",
      "exposed_root": ".",
      "agents_policy": "project_from_cutoff_projection",
      "product_owned_instruction_roots": ["src/personal_assistant/builtin_skills"],
      "expected_instruction_roots": [
        ".claude/skills/change-code-review",
        ".claude/skills/change-design-author",
        ".claude/skills/change-design-reviewer",
        ".claude/skills/change-fast-close",
        ".claude/skills/change-impl-worker",
        ".claude/skills/change-orchestrator",
        ".claude/skills/change-orchestrator-simple",
        ".claude/skills/change-retro",
        ".claude/skills/change-reviewer",
        ".claude/skills/change-spec-author",
        ".claude/skills/change-spec-reviewer",
        ".claude/skills/change-verifier",
        ".claude/skills/codebase-design",
        ".claude/skills/improve-codebase-architecture",
        ".claude/skills/prod-fleet-deploy",
        ".claude/skills/reverse-engineer-claude-code",
        ".claude/skills/systematic-debugging",
        "docs/changes/archive/refactor-486-agent-native-repository-knowledge-system/research-writing-artifacts/skill"
      ],
      "expected_removed_roots": [
        ".claude",
        "CLAUDE.md",
        "cc-hooks-off",
        "cc-hooks-on",
        "docs/changes/feat-397-spec-design-agent-team",
        "docs/development/change-workflow.md",
        "docs/changes/archive/refactor-486-agent-native-repository-knowledge-system/research-writing-artifacts/skill"
      ],
      "hashes": {
        "raw_archive_sha256": "87b70fc3b9f0ac66ac3767c9108d720f7eff276676ed997c7fa4324e8abd3d0f",
        "source_agents_sha256": "c948b0beb8172d4e818349daaa9e11b6f28039e443c7764b97475817c9101420",
        "agents_projection_sha256": "0bdb6e9a69ff0d28784ea0bd374ac9416234adeb531a10f92fbd730f94517859",
        "removed_files_manifest_sha256": "b0f08a875267c3e133ab2ac0387edb88489345c08515d67301919eab099c73d1",